{
  "$schema": "https://xmintake.github.io/registry/meta/xmintake-schema.v1.json",
  "schemaId": "mm.test-1222",
  "schemaVersion": "0.1",
  "description": "Intake Form",
  "fields": {
    "Title": {
      "type": "string",
      "label": "Title",
      "nullable": false,
      "description": "Item title. Keep it short to 55 characters. ",
      "uiVariant": "single_line"
    },
    "Desc": {
      "type": "string",
      "label": "Desc",
      "nullable": false,
      "description": "Item description.",
      "uiVariant": "multi_line"
    },
    "Number": {
      "type": "number",
      "label": "Number",
      "nullable": false,
      "default": "22",
      "description": "Numerical rates for the item. Defaulted to 22."
    }
  },
  "sharePayloadMapping": {
    "sharedText": "Title"
  }
}
